{
  "contract_version": "minerva-knowledge/1.0-draft",
  "snapshot_id": "0b1c2d3e-4f50-4617-8899-aabbccddeeff",
  "snapshot_seq": 1060,
  "source_instance_id": "dev-synthetic",
  "generation": "3f6c9a1e-5b2d-4c8e-9f10-2a3b4c5d6e7f",
  "items": [
    {
      "document_id": "email:5531",
      "document_type": "email",
      "document_revision": 3,
      "content_version": "sha256:be1b5ed38bf79d3a8023ad52b6cc04e8343d0df89413f0787170adacff423ea8"
    },
    {
      "document_id": "email:5540",
      "document_type": "email",
      "document_revision": 1,
      "content_version": "sha256:35e6ed52f1a815f9b48e99fe3a86fe0b7456b0a5b617a87ca15915ae33e8c55b"
    }
  ],
  "next_cursor": "c2",
  "complete": false
}
