{
  "contract_version": "minerva-knowledge/1.0-draft",
  "snapshot_id": "0b1c2d3e-4f50-4617-8899-aabbccddeeff",
  "snapshot_seq": 1060,
  "source_instance_id": "dev-synthetic",
  "generation": "3f6c9a1e-5b2d-4c8e-9f10-2a3b4c5d6e7f",
  "items": [
    {
      "document_id": "email:5601",
      "document_type": "email",
      "document_revision": 2,
      "content_version": "sha256:fbb0cb4a303b233380b8630c75046f6434497ab8ea264de04ead43b55b7c292a"
    }
  ],
  "next_cursor": null,
  "complete": true
}
